Category_name,prodtype,#Website_link,Page_type,VMID,ID,Name,Short_description,Description,rxcode,first_paragraph,features,@image,sizes_dia,size_min,size_max,max_pressure,temp_min,temp_max,operation,connection,material,materialsu,sterilizable,shore_hardness,leak_resistance,flowrate_min,flowrate_max
Mixers,SS,https://romynox.nl/bearing-gmp-5000-10000-20000-novaseptic-style?utm_source=catalogue_RVS&utm_medium=qrcode&utm_campaign=catalogue_page,1,537,2529,"Bearing GMP 5000 / 10000 / 20000 (NovAseptic Style)","Kest Retrofit for GMP 5000 / 10000 / 20000","The bearings are 100% corresponding with the Silicone carbide NovAseptic bearings, but have an extended lifespand because of the material. Zirconium dioxide is chemically unreactive, making it very suitable for applications in biotechnology. The biggest advantage over Siliciumcarbide (used by NovAseptic) is the toughness and robustness, making it able to run dry. The bearings are delivered with a FDA and USP Class VI certificate. ","MKF ","The KEST Retrofit bearing is an improved version of the NovAseptic bearing. Made of Zirconium dioxide ceramic, it can run dry without damaging. Making the mixing process far more efficient. ","can run dry without damaging RXBLLTchemically unreactive, RXBLLTcertificates: FDA, USP Class VI, 3.1",/product-images/KEST-Retrofit-NovAseptic-Male-Bearing-KM1-MB30-Zr.jpg,,,,7,0,135,,Threaded,"Zirconium Dioxide, 316L (1.4435)",,,,,,
Mixers,SS,https://romynox.nl/kest-dish-end-tank-bottom?utm_source=catalogue_RVS&utm_medium=qrcode&utm_campaign=catalogue_page,1,748,19581,"Kest - Dish-end Tank Bottom","A cost-efficient tank bottom with integrated tank plate and valve","The Dish-end is designed to provide a cost-efficient solution by bringing all your process needs together in one design. The Dish-end offers flexibility by removing design constraints that can be caused by difficult welding operations or angles and offers a variety of sizes with diameters up to 500mm.  Optimization The tank plate of the mixer can be positioned very precisely without having to think about welding parameters. This improves the conditions for full product recovery and provides an optimized mixing time. Custom The valve housing and sensors are integrated into the design according to your specifications and can be placed without having to take welding parameters into account. The standard material of the Dish-end can be converted into the material your process needs. ","MKE ","The Kest Dish-end is a cost-efficient tank bottom with integrated tank plate and valve made of one block of stainless steel. No more difficult welding required!","Diameters up to 500 mm RXBLLTMade from one solid rod RXBLLT3.1 material certificate RXBLLTDiaphragm valve RXBLLTIntegrated tank plate",/product-images/Kest-Dish-end-tank-bottom-1.png,,,,,,,,,,,,,,,
Mixers,SS,https://romynox.nl/km-atex-kest-magnetic-coupled-mixer?utm_source=catalogue_RVS&utm_medium=qrcode&utm_campaign=catalogue_page,1,650,2981,"Kest - KM ATEX - Magnetic Coupled Mixer","For volumes to 22000 liter, ATEX Zone 1 and 21.","The ideal choice for critical pharma and biotech applications where full product recovery is important. The mixer is classified for Zone 1 and 21 inside and outside of the tank. The Kest Mixer ATEX magnetic coupled mixer has a unique mix of intelligent controls, user-friendly design and innovative engineering. Its unique design and many powerful features provide cost efficient, low maintenance mixing processes with reliable results. Everything from its mixing head design and the bearing materials is built for one thing: perfect flow.  Full product recovery and zero particle shedding The unique mixing head design and the position of the blades close to the bottom of the tank allows the mixer to run while the tank is being emptied, which ables the mixer to mix low levels as well. Mixing to the last drop with uncompromised cleanability. The robust bearing combination of Zirconium and Sic and the fine-tuned geometry, ensures no particle build-up in the media. The higher bending strength of the zirconium material enables the male bearing to be made in one solid piece. This optimizes the aseptic design and increases the robustness and low wear property of the bearing. ATEX Zone 1 and 21 The mixer is ATEX classified for zone 1 and 21 inside and outside of the tank, to coop with most situations. More information about the ATEX string in the datasheet. Total integrity of the tank The Mixer tank plate is machined from a solid bar. The design is FEM analyzed in comly with PED and ASME pressure vessel code. The tank plate is welded into the tank and creates a solid barrier with no risk of contamination of the media inside the tank.  Minimize down time The drive unit is equipped with the patented Kest-Lock connection that ensures quick disconnection from the tank plate during maintenance. When you put the drive unit back on the tank plate, the spring closed Kest-Lock helps the operator to hold the drive unit in place when tightening the screw. ","MKA ","Kest Mixer KM ATEX for Zone 1 and 21 is a bottom mounted magnetic coupled mixer. Aseptic design and excellent mixing performance, able to mix to the last drop.","ATEX Zone 1 and 21 RXBLLTFull traceability on all parts with media contact RXBLLTAll tank plates are FEM Analyzed according to PED and ASME RXBLLTZero particle shedding RXBLLTShort down time","/product-images/KEST-MAGNETIC-COUPLED-MIXER,-KM-ATEX.jpg",,,,10,0,150,,,"316L (1.4435)",,,,,,
Mixers,SS,https://romynox.nl/km-kest-magnetic-coupled-mixer?utm_source=catalogue_RVS&utm_medium=qrcode&utm_campaign=catalogue_page,1,57,2978,"Kest - KM Mixer Magnetic Coupled","For volumes from 0,2 to 22.000 liter","The Kest Mixer is a bottom mounted magnetic coupled mixer and has a unique mix of intelligent controls, user-friendly design and innovative engineering. Its unique design and many powerful features provide cost efficient, low maintenance mixing processes with reliable results. Everything from its mixing head design and the bearing materials is built for one thing: perfect flow. Full product recovery and zero particle shedding The unique mixing head design and the position of the blades close to the bottom of the tank allows the mixer to run while the tank is being emptied, which anables the mixer to mix lower levels as well. Mixing to the last drop with uncompromised cleanability. The robust bearing combination of Zirconium and Sic and the fine-tuned geometry, ensures no particle generation in your media. The higher bending strength of the zirconium material enables the male bearing to be made in one solid piece. This optimizes the aseptic design and increases the robustness and low wear property of the bearing. Total integrity of the tank The Mixer tank plate is machined from a solid bar. The design is FEM analyzed in comly with PED and ASME pressure vessel code. The tank plate is welded into the tank and creates a solid barrier with no risk of contamination of the media inside the tank.  Full control and minimal down time The Kest Mixer can be equipped with an intelligent speed sensor system to control the actual movement of the mixing head in the tank. The system can detect if the mixing head is mounted in the tank, the rotation speed of the mixing head and the rotation direction. The drive unit is equipped with the patented Kest-Lock Connection that ensures quick disconnection from the tank plate during maintenance. When you put the drive unit back on the tank plate, the spring closed Kest-Lock helps the operator to hold the drive unit in place when tightening the screw. ","MKM ","Kest Mixer is a magnetic coupled mixer with an aseptic design. Excellent mixing performance, user-friendly and able to mix to the last drop. The ideal choice for critical pharma and biotech applications where full product recovery is important.","Full traceability on all parts with media contact RXBLLTAll tank plates are FEM Analyzed according to PED and ASME RXBLLTZero particle shedding RXBLLTMinimize downtime RXBLLTOptional Stainless Steel cover for a clean look and good cleanability RXBLLTATEX version available",/product-images/KEST-MAGNEET-MIXER.jpg,,,,7,0,150,,,"316L (1.4435)",,,,,,
Mixers,SS,https://romynox.nl/kmpf-kest-mixer-proflow?utm_source=catalogue_RVS&utm_medium=qrcode&utm_campaign=catalogue_page,1,657,3032,"Kest - KMPF Mixer Proflow","Energy efficient stainless steel mixer with a perfect mixing result over and over again","The best mixer they ever built. The ProFlow magnetic coupling mixer is designed to ensure predictable and compliant results, minimize maintenance, minimize waste, minimize energy use and maximise the value created by a mixing process.  Reduce energy consumption The new highly advanced motor has an efficiency of >95%. This will save a lot of energy and thus money, while also benefitting the environment. For example, the smallest mixer in the ProFlow range uses 89-93% less energy than the smallest mixer of the Kest KM range in 24 hours of mixing. This is what we call GREEN MIXING! 80% less energy consumption on average lower costs less Co2 emission Ideal cleanroom mixer The ProFlow mixer is extremely silent during operation because of the design of the drive, enhancing the environment for the operators. The drive unit does not contain any fans that will interfere with your laminar air flow. It is totally capsuled in a smooth hygienic cover that is easy to keep clean. Ideal for a clean room. FULL PRODUCT RECOVERY AND ZERO PARTICLE SHEDDING The unique mixing head design and the position of the blades close to the bottom of the tank allows the mixer to run while the tank is being emptied, which ables the mixer to mix low levels as well. Mixing to the last drop with uncompromised cleanability. The robust bearing combination of Zirconium and Sic and the fine-tuned geometry, ensures no particle generation in your media. The higher bending strength of the zirconium material enables the male bearing to be made in one solid piece. This optimizes the aseptic design and increases the robustness and low wear property of the bearing. TOTAL INTEGRITY OF THE TANK The Mixer tank plate is machined from a solid bar. The design is FEM analyzed in comly with PED and ASME pressure vessel code. The tank plate is welded into the tank and creates a solid barrier with no risk of contamination of the media inside the tank.  REAL TIME CONTROL AND MINIMAL DOWNTIME The ProFlow Mixer is equipped with a range of innovative electronics, monitoring capabilities and intelligent control logic. This gives you maximum process control, unparalleled energy efficiency and minimal heat transfer. The drive unit is equipped with the patented Kest-Lock connection that ensures quick disconnection from the tank plate during maintenance. When you put the drive unit back on the tank plate, the spring closed Kest-Lock helps the operator to hold the drive unit in place when tightening the screw.   ProFlow range KMPF0/3: max capacity 30 liter KMPF3/7: max capacity 70 liter KMPF7/20: max capacity 200 liter KMPF20/70: max capacity700 liter KMPF70/120: max capacity 1.200 liter  ","MKN ","The brand new mixer range from Kest. Over 30 years of experience in the mixer and pharmaceutical industries leads to the ProFlow.","80% less energy consumption on average RXBLLTlower costs RXBLLTless Co2 emission",/product-images/FamilyPicture_B_A-Kest.jpg,,,,7,0,135,,,"316L (1.4435)",,,,,,
Mixers,SS,https://romynox.nl/kms-kest-mixer-small-volume?utm_source=catalogue_RVS&utm_medium=qrcode&utm_campaign=catalogue_page,1,86,3037,"Kest - KMS Mixer small volume","Magnetic coupled mixer for low volumes from 0,2 to 200 liters","The Kest Mixer Small Volume (KMS) has an unique mix of intelligent controls, user-friendly design and innovative engineering. Its unique design and many powerful features provide cost efficient, low maintenance mixing processes with reliable mixing results. Everything from its mixing head design and the bearing materials is built for one thing: perfect flow.  Full product recovery and zero particle shedding The unique mixing head design and the position of the blades close to the bottom of the tank allows the mixer to run while the tank is being emptied, which ables the mixer to mix low levels as well. Mixing to the last drop with uncompromised cleanability. The robust bearing combination of Zirconium and Silicone carbide (SiC) and the fine-tuned geometry, ensures no particle generation in your media. The higher bending strength of the zirconium material enables the male bearing to be made in one solid piece. This optimizes the aseptic design and increases the robustness and low wear property of the bearing. Total integrity of the tank The Mixer tank plate is machined from a solid bar. The design is FEM analyzed in comly with PED and ASME pressure vessel code. The tank plate is welded into the tank and creates a solid barrier with no risk of contamination of the media inside the tank.  Cleanroom optimized mixing The KMS drive unit operates completely without fans and is fully encapsulated in a smooth hygienic cover. This makes the KMS very easy to keep free from dust and particles, and allows for undisturbed laminar air flow in your cleanroom.  Real time control and minimal downtime The KMS is equipped with a range of innovative electronics, monitoring capabilities and intelligent control logic. This gives you maximum process control, unparalleled energy efficiency and minimal heat transfer. The speed sensor system can detect if the mixing head is mounted in the tank, the rotation speed of the mixing head and the rotation direction. The speed is controlled with 1-10 VDC so there is no need for a VFD. The drive unit is equipped with the patented Kest-Lock connection that ensures quick disconnection from the tank plate during maintenance. When you put the drive unit back on the tank plate, the spring closed Kest-Lock helps the operator to hold the drive unit in place when tightening the screw.   ","MKS ","It can be used in a small tank or as an extra mixer in a large tank to mix the last part of the fluid where the main mixer cannot mix to the last drop.","Full traceability on all parts in media contact RXBLLTAll tank plates are FEM analyzed according to PED and ASME RXBLLTZero particle shedding RXBLLTFull product recovery RXBLLTNo effect on laminar airflow in cleanroom RXBLLTMinimize downtime",/product-images/Kest-Mixer-KMS-Mini-Magnetic-Mixer.jpg,,,,7,0,150,,,"316L (1.4435)",,,,,,
Mixers,SS,https://romynox.nl/kest-bearings-for-magnet-mixers?utm_source=catalogue_RVS&utm_medium=qrcode&utm_campaign=catalogue_page,1,85,2911,"Kest - Male Bearings for magnet mixers","Kest-Mixer Standard male bearings made of ZrO2","The bearings are 100% corresponding with the Silicone carbide NovAseptic bearings, but have an extended lifespand because of the material. Zirconium dioxide is chemically unreactive, making it very suitable for applications in biotechnology. The biggest advantage over e.g. Siliciumcarbide is the toughness and robustness, making it able to run dry. The bearings are delivered with a FDA and USP Class VI certificate.","MKK ","Kest-Mixer standard bearings are manufactured from one solid piece of Zirconium dioxide (ZrO2), which ensures an optimized, robust and aseptic design. This makes the bearings able to withstand the impact of shaking, bumping and possible to run dry. These properties makes the Kest-Mixer bearings unique in lifespand and productivity. ","chemically unreactive RXBLLTlong lifespand  RXBLLTable to run dry",/product-images/Kest_parts_4f44df4ad617a.jpg,,,,,0,135,,,,,,,,,
Mixers,SS,https://romynox.nl/bearing-gmp-100-novaseptic-style?utm_source=catalogue_RVS&utm_medium=qrcode&utm_campaign=catalogue_page,1,536,2509,"Kest - Retrofit Male Bearing GMP 100 (NovAseptic Style)","Kest Retrofit bearing for GMP 100","The bearings are 100% corresponding with the Silicone carbide NovAseptic bearings, but have an extended lifespand because of the material. Zirconium dioxide is chemically unreactive, making it very suitable for applications in biotechnology. The biggest advantage over Siliciumcarbide (used by NovAseptic) is the toughness and robustness, making it able to run dry. The bearings are delivered with a FDA and USP Class VI certificate. ","MKF ","The KEST Retrofit bearing is an improved version of the NovAseptic bearing. Made of Zirconium dioxide ceramic, it can run dry without damaging. Making the mixing process far more efficient. "," can run dry without damaging RXBLLT chemically unreactive RXBLLTcertificates: FDA, USP Class VI, 3.1",/product-images/KEST-Retrofit-NovAseptic-Male-Bearing-KM1-MB16-Zr.jpg,,,,7,0,135,,Threaded,"Zirconium Dioxide, 316L (1.4435)",,,,,,
Mixers,SS,https://romynox.nl/rm-atex-kest-magnetic-coupled-mixer-rapid-motion-atex?utm_source=catalogue_RVS&utm_medium=qrcode&utm_campaign=catalogue_page,1,734,3402,"Kest - RM Mixer ATEX Rapid Motion","Vigorous mixer for volumes up to 8.000 liters, suitable for ATEX Zone 1 and 21.","The Rapid Motion Mixer ATEX is a bottom mounted magnetically coupled mixer with a user-friendly design and innovative engineering. Its unique design and many powerful features provide cost efficient, low maintenance processes with reliable mixing results in an explosive environment. Everything from its mixing head design and the bearing materials is built for one thing: perfect flow.  Vigorous mixing with a perfect result The unique mixing head design with small wings allows to run the mixing head fast enough to create high-intensity mixing, a way of injecting more energy into the tank. This is excellent when you like to incorporate powder that floats on top or easily creates lumps. It also works ideal for buffer tanks and upstream applications. Zero particle shedding The robust bearing combination of Zirconium and Sic and the fine-tuned geometry, ensures no particle generation in your media. The higher bending strength of the zirconium material enables the male bearing to be made in one solid piece. This optimizes the aseptic design and increases the robustness and low wear property of the bearing. ATEX zone 1 and 21 The Mixer is ATEX classified for zone 1 and 21 inside and outside of the tank, to coop with most situations. More information about the ATEX string in the datasheet. Total integrity of the tank The Mixer tank plate is machined from a solid bar. The design is FEM analyzed in comly with PED and ASME pressure vessel code. The tank plate is welded into the tank and creates a solid barrier with no risk of contamination of the media inside the tank.  Minimize downtime The drive unit is equipped with the patented Kest-Lock connection that ensures quick disconnection from the tank plate during maintenance. When you put the drive unit back on the tank plate, the spring closed Kest-Lock helps the operator to hold the drive unit in place when tightening the screw. ","MKB ","KEST Rapid Motion Mixer ATEX for Zone 1 and 21 is built for a perfect mixing result. Minimal downtime, zero particle shedding and no contamination risk. Ideal for powder mixing, buffer tanks and upstream applications. ATEX Classified for Zone 1 and 21 inside and outside of the tank.","ATEX Zone 1 and 21 RXBLLTFull traceability on all parts in media contact RXBLLTAll tank plates are FEM Analyzed according to PED and ASME RXBLLTZero particle shedding RXBLLTMinimize downtime",/product-images/RM-ATEX-website.jpg,,,,7,0,150,,,"316L (1.4435)",,,,,,
Mixers,SS,https://romynox.nl/rm-kest-magnetic-coupled-mixer-rapid-motion?utm_source=catalogue_RVS&utm_medium=qrcode&utm_campaign=catalogue_page,1,490,3399,"Kest - RM Mixer Rapid motion","Vigorous mixer for volumes up to 8.000 liter"," The Kest Rapid Motion Mixer is a bottom mounted magnetically coupled mixer with a user-friendly design and innovative engineering. Its unique design and many powerful features provide cost efficient, low maintenance processes with reliable mixing results. Everything from its mixing head design and the bearing materials is built for one thing: perfect flow.  Vigorous mixing with a perfect result The unique mixing head design with small wings allows to run the mixing head fast enough to create high-intensity mixing, a way of injecting more energy into the tank. This is excellent when you like to incorporate powder that floats on top or easily creates lumps. It also works great for buffer tanks and upstream applications. Zero particle shedding The robust bearing combination of Zirconium and Sic and the fine-tuned geometry, ensures no particle generation in your media. The higher bending strength of the zirconium material enables the male bearing to be made in one solid piece. This optimizes the aseptic design and increases the robustness and low wear property of the bearing. Total integrity of the tank The Mixer tank plate is machined from a solid bar. The design is FEM analyzed in comly with PED and ASME pressure vessel code. The tank plate is welded into the tank and creates a solid barrier with no risk of contamination of the media inside the tank.  Minimize downtime The drive unit is equipped with the patented Kest-Lock connection that ensures quick disconnection from the tank plate during maintenance. When you put the drive unit back on the tank plate, the spring closed Kest-Lock helps the operator to hold the drive unit in place when tightening the screw. ","MKR ","Kest Rapid Motion Mixer is built for a perfect mixing result with high-intensity mixing, minimal downtime, zero particle shedding and no contamination risk. Ideal for powder mixing, buffer tanks and upstream applications up to 8.000 liter. ","Vigorous Mixing RXBLLTFull traceability on all parts in media contact RXBLLTAll tank plates are FEM Analyzed according to PED and ASME RXBLLTZero particle shedding RXBLLTMinimize downtime RXBLLT<a href=""en/pharma-en/mixers/kest-magnetic-mixer-rapid-motion-atex-detail"">ATEX Version</a> available",/product-images/Kest-Magnetic-Mixer-Rapid-Motion.jpg,,,,7,0,150,,,"316L (1.4435)",,,,,,
"Orifice plate",SS,https://romynox.nl/orifice-plate-spool?utm_source=catalogue_RVS&utm_medium=qrcode&utm_campaign=catalogue_page,3,279,3244,"Orifice Plate Spool","Conical orifice spool","It is manufactured in 316L stainless steel with wetted surfaces finished to 0,5 ?m Ra.  ","FPS ","A conical design that utilises a tapered profile to reduce the bore to the orifice size.","316L stainless steel RXBLLTreduce the bore RXBLLTconnections: Tri-clamp RXBLLTcertificates: 3.1 solid bar",/product-images/ro_orifice-spool-conic-ops.jpg,,1/2,2,,,,,Tri-Clamp,"316L (1.4404)",,,,,,
"Orifice plate",SS,https://romynox.nl/orifice-spools-kits?utm_source=catalogue_RVS&utm_medium=qrcode&utm_campaign=catalogue_page,3,645,3247,"Orifice Spools Kits","Go for the correct flow"," When an Orifice is built in, calculations are not always available. With this kit you can test which orifice gives the desired result and then order the right one.","FPK ","The Orifice Spool Kit makes it easy to determine the correct size of Orifice.","connections: Tri-clamp RXBLLTcertificates: 3.1 material RXBLLTAll Orifice Spools are provided with a marking of the size and orifice dimensions. RXBLLTLow density polyethylene foam, keeps cleanroom contamination as low as possible!",/product-images/Rx_orrifice-spools_kits.jpg,,1/2,"1 1/2",,,,,,"316L (1.4404)",,,,,,
"Orifice plate",SS,https://romynox.nl/orifice-plate?utm_source=catalogue_RVS&utm_medium=qrcode&utm_campaign=catalogue_page,3,97,3239,"Rubber Fab - Orifice plate","Concentric and eccentric versions","It prevents dead legs, maintains flow, while assuring self drainage thereby eliminating the potential for soil retention. Tabs help to acknowledge that an orifice plate is 'in line'. On the tab an engraving indicates the hole diameter.   ","FPP ","Available both in concentric (OP3) and eccentric (OP4) drilled plates as well as a solid plate design.","prevents dead leg RXBLLTmaintaining flow  RXBLLTeliminating the potential for soil retention",/product-images/RF.orifice.plate_4f184ee5c5ae6.jpg,,1/2,6,,,,,,"EPDM, PTFE, FKM, Silicone",,,,,,
"Pinch valves",SS,https://romynox.nl/arterial-process-module?utm_source=catalogue_RVS&utm_medium=qrcode&utm_campaign=catalogue_page,1,175,2486,"ARTeSYN - ARTERIAL PROCESS MODULE","Fluid management solution for single use process systems","The APM is a next generation fluid management solution for single use process systems allows you to modulate and control flow without having to use your fingers as the control valve. Enter the 21st century of automated disposable process systems with this unique, customizable modular solution. The modular APM offering enables you to minimize even further your hold up volumes, while you to automate and regulate the flow of your process. Then again, just throw away the fluid path. No mess. No clean up.","HPB ","The ARTeSYN Arterial Process Module APM (Patented) allows the user to control complex processes like chromatography, or filtration, that are greatly improved with computer automation and toss the flow path when it is finished. No cleaning validation requirements. No cross contamination concerns. Simple. Straightforward","No cleaning validation requirements RXBLLTNo mess or clean up RXBLLTCustomizable modular solution RXBLLTAllows the user to control complex processes",/product-images/AQ_process_module.jpg,,,,,,,,Tri-Clamp,"316L (1.4404), 316L (1.4435)",,,,,,
