Category_name,prodtype,#Website_link,Page_type,VMID,ID,Name,Short_description,Description,rxcode,first_paragraph,features,@image,sizes_dia,size_min,size_max,max_pressure,temp_min,temp_max,operation,connection,material,materialsu,sterilizable,shore_hardness,leak_resistance,flowrate_min,flowrate_max
"Single-Use (Pinch) Valves",SU,https://romynox.nl/artesyn-steam2-valve?utm_source=catalogue_RVS&utm_medium=qrcode&utm_campaign=catalogue_page,2,695,19521,"ARTeSYN - Steam2 valve","Minimized dead leg for flexible and safe aseptic fluid transfers","Available with progressive manual actuation in a variety of stainless steel connection types. This is for a reliable connection between two stainless steel flange ends. Single-use flow path The single-use flow path made of ARTeSIL® molded silicone has a seal-free actuation mechanism, making it safe and reliable. The single-use tubing end is fabricated from braided silicone and is available in several sizes. Processes The Steam2 valves are designed for liquid or gas transfer applications, both pressurized and unpressurized. Suitable for upstream applications like mixing, filtration, perfusion and media preparation, and downstream processes like chromatography, fractionation, transfers and filling. The Steam 2 valves enable aseptic transfer of fluid from traditional to single use process wetted parts.  ","HPG ","ARTeSyn Steam2 valves deliver a design with minimized dead leg, providing a solution for flexible and safe aseptic fluid transfers at industrial scale.","Safe, reliable and simplified processing RXBLLTReduced down time RXBLLTEliminates cross contamination risk  RXBLLTImproves project flexibility  RXBLLTFacilitated sterilization validation",/product-images/Steam2.png,,,,,,,,,,,,,,,
"Single-Use (Pinch) Valves",SU,https://romynox.nl/flowlinx-pinch-valve?utm_source=catalogue_RVS&utm_medium=qrcode&utm_campaign=catalogue_page,2,1346,31165,"FLOWLINX - Pinch Valve","available in 2 sizes, 1/8?(3,175mm) to 1/2?(12,7mm) OD tube and 5/8""(15,8mm) to 1-3/8?(9,5mm) OD tub",," ","FlowLinX Pinch Valves are suited for liquid flow control and shut off, in high purity applications.",,"/product-images/pinch valve 1 white background 1.png",,,,,,,,,,,"Autoclave, Gamma Irradiation",,100,,
"Single-Use (Pinch) Valves",SU,https://romynox.nl/biovalve-pinch-valve?utm_source=catalogue_RVS&utm_medium=qrcode&utm_campaign=catalogue_page,2,753,19548,"NORDSON MEDICAL - BioValve Pinch valve","1/4"" (6.4 mm) to 1"" (12.7 mm) OD",,"QSC ","BioValve Pinch Valve is a precise flow controller and valve for tubing used in (bio)pharmaceutical applications.",,"/product-images/BioValve Pinch Valve.jpg",,,,,,,,,,,"Autoclave, SIP",,150,,
"Single-Use (Pinch) Valves",SU,https://romynox.nl/pharmalok-tube-clamp?utm_source=catalogue_RVS&utm_medium=qrcode&utm_campaign=catalogue_page,2,467,3258,"NORDSON MEDICAL - PharmaLok Tube Clamp","Tube Clamp to securely close of flow of Single Use tubing","Pharmalok clamps provide a significant advancement for the industry, as a number of existing solutions either require tools for closure or consist of multiple components, which turns what should be a simple operation into a difficult and awkward process.  Nordson MEDICAL's PharmaLok tube clamp supports tubing sizes from .5"" to 1.25"". Can be easily operated with one hand, PharmaLok""s Patent pending design allows effortless attachment. The user simply lightly grips the surrounding handles, and listens for clicks to confirm a secure connection. ","QSA ","A ground-breaking clamp designs that simplify the assembly process by making it effortless to securely close of flow of Single Use tubing","Effortlessly and securely close off flow RXBLLTFor use with silicone and TPE tubing RXBLLTEasy, one-handed closure?no tools needed RXBLLTTamper evident and zip-tie compatible RXBLLTMaterials meet USP Class VI & ISO 10993 criteria",/product-images/pharmalok_tube_clamp_01.jpg,,,,,-70,"	60",,,"Glass filled nylon",,"Autoclave, Gamma Irradiation, X-Ray",,,,
"Single-Use Bag Assemblies",SU,https://romynox.nl/2d-single-use-bags-2?utm_source=catalogue_RVS&utm_medium=qrcode&utm_campaign=catalogue_page,1,767,19510,"2D Single-use bags","Applicable throughout all process steps in biopharmaceutical production","The 2D Bags are available in the following volumes: 5ml, 50ml, 100ml, 250ml, 500ml, 1L, 2L, 5L, 10L, 20L, 35L, 50L.In the event that your production requires other volumes or dimensions, ROMYNOX can supply a custom made bag based on your specifications. Even for small orders, ROMYNOX can assist you. Depending on your needs, we can supply 2D Bags in different volumes, tubings, connectors and assemblies. The scalability of 2D Bags allows you to use them throughout the entire biopharmaceutical manufacturing process. Usable from upstream to downstream production (e.g. media and buffer storage, transfer after filtration, storage of intermediates and storage of stock solutions). RENOLIT 9101 Renolit 9101 films are made up of five layers. ULDPE and EVOH prevent the ingress or egress of oxygen, carbon oxide and moisture. LDPE and HDPE guarantee high process reliability. A visual overview of the composition of layers is illustrated below.     The 2D single-use bags minimize cross-contamination risk and significantly increase safety. Cleaning and sterilization are not required and production efficiency is improved. In addition, it reduces QC and cleaning verification costs. SPECIFICATIONS ISO® 9001:2015 quality management system ISO class 7 clean zones 100% leak test ADCF raw materials Meet FDA requirements for indirect food additives listed in 21 CFR 177?182 Meet the requirement of USP In Vitro Biological Reactivity Test Meet the criteria of the USP Biological Reactivity Test for Class VI Plastics Aqueous extraction contains < 0.25 EU/ml as determined by Limulus Amebocyte Lysate (LAL), USP Particles in product eluent meet requirements in USP for large volume parenteral drugs Check gamma radiation dose according to ISO® 11137 Provide a product validation guide and a quality certificate","EBK ","An alternative to bioprocess bags for storage, sampling and transfer and shipping of liquids in all process steps Depending on your production scale, we supply the right size bag for an optimal process.","Customizable to various processes RXBLLTLow extractables and precipitation RXBLLTGamma-sterilizable",/product-images/2d-bag.jpg,,,,,,,,,,,,,,,
"Single-Use Bag Assemblies",SU,https://romynox.nl/3d-single-use-bags?utm_source=catalogue_RVS&utm_medium=qrcode&utm_campaign=catalogue_page,1,768,19515,"3D Single-use bags","Available in 50L, 100L, 200L, 250L, 500L, 1000L, 2000L, 3000L.","An alternative to bioprocess bags for storage, sample collection, transfer and shipping of liquids in all process steps. Depending on your production scale, we supply the right size bag for an optimal process.The 3D Bags in: 50L, 100L, 200L, 250L, 500L, 1000L, 2000L, 3000L.In cases where your production requires other volumes or dimensions, ROMYNOX can provide you with a bag that is tailored to your needs. Even for small orders, ROMYNOX can assist you. Depending on your needs, we can supply the 3D Bags in different volumes, tubings, connectors and assemblies. The scalability of the 3D Bags allows you to use them throughout the entire biopharmaceutical manufacturing process. Usable from upstream to downstream production (e.g. media and buffer storage, transfer after filtration, storage of intermediates and storage of stock solutions). RENOLIT 9101 Renolit 9101 is made up of five layers. ULDPE and EVOH prevent the ingress or egress of oxygen, carbon oxide and moisture. LDPE and HDPE guarantee high process reliability. A visual overview of the composition layers is illustrated below.     The 3D single-use bags minimize the risk of cross-contamination and significantly increase safety. Cleaning and sterilization is not required and production efficiency is improved. In addition, it reduces the cost of QC and cleaning verification. SPECIFICATIONS ISO® 9001:2015 quality management system ISO class 7 clean zones 100% leak test ADCF raw materials Meet FDA requirements for indirect food additives listed in 21 CFR 177?182 Meet the requirement of USP In Vitro Biological Reactivity Test Meet the criteria of the USP Biological Reactivity Test for Class VI Plastics Aqueous extraction contains < 0.25 EU/ml as determined by Limulus Amebocyte Lysate (LAL), USP Particles in product eluent meet requirements in USP for large volume parenteral drugs Check gamma radiation dose according to ISO® 11137 Provide a product validation guide and a quality certificate","EBL ","Is applicable throughout all process steps in biopharmaceutical production,","Customizable to various processes RXBLLTLow extractables and precipitation RXBLLTGamma-sterilizable ",/product-images/Cobetter-3D-bag-600x600px.jpg,,,,,,,,,,,,,,,
"Single-Use Bag Assemblies",SU,https://romynox.nl/crl-beta-bag?utm_source=catalogue_RVS&utm_medium=qrcode&utm_campaign=catalogue_page,1,769,19556,"CRL - Beta Bag Getinge style","The Beta Bag allows you to transfer components and materials in and out of an isolator or RABS.","These bags are used in aseptic production to maintain sterility in the isolator. The Beta Bag allows you to transfer components and materials in and out of an isolator or RABS, while minimizing the risks of microbial and particulate contamination. This assures the most sterile, aseptic process possible, while eliminating costly and time-consuming cleaning and sterilization procedures. The opening size is 190mm, which means it is compatible with Getinge® style Alpha ports. This can accommodate objects with a width of 170 to 175mm. ROMYNOX can help you with aseptic production by pre-filling the Beta Bags with your desired objects.Because we sell from our own stock and have ISO 7 cleanroom capacity for pre-packing, this is possible with fast turnaround times. The Beta Bag consists of a single layer of material. Tyvek® and a high-density polyethylene (HDPE) plastic that are welded together to form a strong connection. Tyvek® is a high-density polyethylene fiber used as a sterile barrier to allow autoclave sterilization. HDPE has an excellent strength-to-density ratio, which gives it excellent tensile strength and is highly resistant to tearing or ripping. In addition, it is still possible to see the Beta Bag contents. To ensure that components inserted into the isolator meet all sterilization process requirements, the pre-filled beta bag can be autoclaved. The result is a filling line production free from contamination by harmful bacteria, viruses or other microorganisms. The Beta Bag is double-bagged in a polyethylene cleanroom bag. Beta Bag flanges are all 100% leak tested before leaving the factory (checked by CRL).Recommended storage conditions are 13-27°C and 30-60% relative humidity.The Beta Bag should be used according to our specifications. Please see the attached specifications. SPECIFICATION Pressure decay leak test at 5?water Ammonia leak testing Beta Flange Assembly of each lot, according to AGS-G004-2014 Weld testing of each lot, according to ASTM F1140 and ASTM F88 Independent lab testing of cleanliness Tyvek weld peel and dye penetrant test","EBA ","CRL's Beta Bag fits a Getinge® style Alpha port for fast transfer.","Pre-fill option available RXBLLTSuitable of Getinge® style RTP RXBLLTIntegration in final assembly possible RXBLLTAutoclavable",/product-images/CRL-Beta-Bag-2-600x600px.jpg,,,,,,,,,,,,,,,
"Single-Use Bottle Assemblies",SU,https://romynox.nl/hdpe-pharma-process-bottles?utm_source=catalogue_RVS&utm_medium=qrcode&utm_campaign=catalogue_page,1,619,2873,"EZI-DOCK - HDPE Pharma Process Bottles","The most efficient available pharma process bottles","The HDPE process bottles are manufactured from USP Class VI approved HDPE (with an FDA approved anti-static additive) and the design has been optimised for transport; the unique square design produces a valuable space saving of between 40-45%. Specifically designed for the storage and transfer of API powders and granules, the pharma process bottles are lightweight, easy to handle and highly stable. As a result of their compact square design, they are also space-saving, saving both storage and logistics.  The bottles feature a standard 6 inch Tri-Clamp neck design that can be adapted (using an injection moulded adaptor) to standard 4 inch Tri-Clamps. ","ECC ","HPDE pharma process bottles from Ezi-Dock are designed for storage and transfer of API powders and granules. Easy to handle, lightweight and highly stable. ","Full Batch Traceability RXBLLTGamma Stable/Autoclavable RXBLLTCompact square design; space efficient RXBLLTlightweight RXBLLTeasy to handle & very stable",/product-images/ed_pharma_process_bottles-5.jpg,,,,,,,,,,,,,,,
"Single-Use Bottles & Vials",SU,https://romynox.nl/flowlinx-flowtainer-pc-bottle?utm_source=catalogue_RVS&utm_medium=qrcode&utm_campaign=catalogue_page,1,1341,31139,"FLOWLINX - FlowTainer PC Bottle","A bottle from polycarbonate for high-purity fluid handling","The bottle is compatible with weak acids and some alcohol, but not for bases and aggressive solvents. This makes the bottle suitable for freeze, media, and buffer storage and containing aqueous solutions. The Flowtainer has an easy-to-handle design with readable graduation. It is available from 5 mL to 20 L. To fit your process applications, we are able to assemble the bottle with a hose barb cap, tubing, connectors, and vent filter. The bottle is manufactured in an ISO 8 cleanroom and each lot undergoes stringent testing to ensure it meets the highest standards as USP and USP .See the regulatory overview for a clear summary. Specification       Low temperature storage and transport to -90°C Gamma readable Ups Class VI and animal component free Technical data","CBB ","Polycarbonate is impact resistant and are excellent for storage and transport in -90°C.","Manufactured in an ISO 8 cleanroom RXBLLTEasy to read graduations RXBLLTExcellent for freezing and storage applications RXBLLTValidation package available","/product-images/pc bottle one white background.png",,,,,"-90 ",,,,,,"Gamma Irradiation",,,,
"Single-Use Bottles & Vials",SU,https://romynox.nl/flowlinx-flowtainer-cap?utm_source=catalogue_RVS&utm_medium=qrcode&utm_campaign=catalogue_page,1,1343,31404,"FLOWLINX - Flowtainer cap","High density polyethylene cap with hose barb","This allows you to assemble the Flowtainer bottle to your process application. For fluid handling in filling, freezing, thawing, storage, and transport, ROMYNOX can assemble with tubing, connectors and a vent filter Specification       Low temperature storage and transport (to -90°C) Gamma readable Ups Class VI and animal component free","CBA ","With the Flowtainer cap you can have 2 to 4 hose barbs with multiple sizes","Manufactured in an ISO 8 cleanroom RXBLLTNon-sterile RXBLLTValidation package available","/product-images/F-BCC-70-1 FlowTainer 70mm Cap, 1.png",,,,,"-90 ",,,,,,"Gamma Irradiation",,,,
"Single-Use Bottles & Vials",SU,https://romynox.nl/freudenberg-silicone-stoppers?utm_source=catalogue_RVS&utm_medium=qrcode&utm_campaign=catalogue_page,1,1362,31010,"FREUDENBERG - Silicone Stoppers","For tight, reliable seals","These platinum-cured silicone stoppers have full traceability to raw materials, contain no peroxide catalysts, and are autoclavable. Biologically safe, they can be used with glass, metal, or plastic vessels.  In our clean room, we can add stoppers in assemblies. Stoppers, caps, and inserts for True Unions, with or without tubing, are available. The stoppers come in a variety of sizes and have multiple capabilities such as pre-drilled holes and the ability to be added to assemblies. Available in 14 standard sizes. We also offer stoppers with pre-drilled holes.   Technical data"," ","HelixMark® pharmaceutical-grade Silicone Stoppers are ideal for tight, reliable sealing glass tubes, vials, and flasks.","Packaged 12 per zip bag in crush-resistant boxes RXBLLTAutoclavable RXBLLTcontain no peroxide catalysts","/product-images/silicone stopper.jpg",,,,,,,,,,,,,,,
"Single-Use Bottles & Vials",SU,https://romynox.nl/freudenberg-two-hole-stoppers?utm_source=catalogue_RVS&utm_medium=qrcode&utm_campaign=catalogue_page,1,1361,31106,"FREUDENBERG - Two-Hole Stoppers","For tight, reliable seals","Two-Hole Stoppers have full traceability down to the raw material, contain no peroxide residues, and are autoclavable. In our clean room, we can add stoppers in assemblies. Stoppers, caps, and inserts for True Unions, with or without tubing, are available. The stoppers come in a variety of sizes and have multiple capabilities such as pre-drilled holes and the ability to be added to assemblies. Available in 16 standard sizes, hole diameter ranges from 3mm to 16mm.   Technical data  "," ","Pharmaceutical grade silicone stoppers are platinum-cured and ideal for a tight, reliable seal.","Packaged 12 per zip bag in crush-resistant boxes RXBLLTAutoclavable RXBLLTcontain no peroxide catalysts","/product-images/two hole stopper.jpg",,,,,,,,,,,,,,,
"Single-Use Clamps",SU,https://romynox.nl/flowlinx-sidewinder-pinch-clamp?utm_source=catalogue_RVS&utm_medium=qrcode&utm_campaign=catalogue_page,3,1359,31412,"FLOWLINX - Sidewinder Pinch Clamp OD","The Sidewinder Pinch Clamp from FlowLinx ensures quick and easy installation","This eliminates the need of installing the clamp prior to adding fittings and end connectors, maximizing operational efficiency.Even if you forgot to add a pinch clamp, you can quickly and easily install the Pinch Clamp on an unbraided tubing assembly. The Sidewinder is cost-effective as the product saves installation time and is multi-use. To ensure the quality the Sidewinder Pinch Clamp is validated (by FlowLinx). The clamp underwent various tests: e.g., ASTM E515 bubble emission pressure test, ASTM D5276 drop testing and exposure to ultra-low temperatures. The Sidewinder is available in two sizes and is suitable for unreinforced tubing up to 70 durometers. With the 6 position, you can regulate the flow of the fluid to your specific need. With integral holes the Pinch Clamp is zip tie compatible, aiding process identification and tamper evident process. Specification Manufactured in an ISO 8 Cleanroom ISO 9001:2015 Certified Facility USP Class VI & ISO 10993-5"," ","In contrast to conventional Pinch Clamps, this innovative design allows the tubing to be fitted though the sides of the clamp.","Quick and Easy Installation RXBLLTMulti-Use RXBLLTValidated pinch clamp RXBLLT6-Position Rachet for Precise Flow Regulation","/product-images/Sidewinder Pinch Clamp, up to 0 3.jpg",,,,,,,,,,,"Autoclave, Gamma Irradiation",,,,
"Single-Use Clamps",SU,https://romynox.nl/flowlinx-tc-clamp?utm_source=catalogue_RVS&utm_medium=qrcode&utm_campaign=catalogue_page,3,1350,31685,"FLOWLINX - TC Clamp","One-handed operation clamp","The clamp design allows the user to safely secure the fitting without any bolt torquing and the audible click makes the process easier to operate. It also ensures that the gasket is not over-compressed, thus eliminating the risk of leaks and other potential issues. FlowLinX Sanitary Clamps are available in 3/4"" (Mini) flange and 1-1/2"" (Maxi) flange sizes and are ASME-BPE compliant. Specification       Tested to 94 PSI (6.5 bar) for Leak Resistance USP Class VI and ISO 10993-5 Pack Size: 25 Clamps per Bag Zip Tie Compatible for Process ID and Tamper Evident Technical data","QHV ","FlowLinX Sanitary Clamps are designed for quick and efficient installation. The innovative clamp design retains the sanitary fittings in the clamp body for effortless one-handed operation.","Manufactured in an ISO 8 cleanroom in accordance with ISO 14644 principles RXBLLTSterilizable by Gamma Irradiation and Autoclave RXBLLTMade of glass reinforced nylon RXBLLTCompatible to ASME-BPE","/product-images/flowlinX tc clamp 1 white background.png",,,,,,,,,,,"Autoclave, Gamma Irradiation",,,,
"Single-Use Clamps",SU,https://romynox.nl/tbl-bio-ease%c2%99-hd-pinch-clamp?utm_source=catalogue_RVS&utm_medium=qrcode&utm_campaign=catalogue_page,3,609,3805,"SANISURE - Bio-Ease HD Pinch Clamp","Non-Metallic Clamp","It is designed to handle higher pressures and be more secure than a standard pinch clamp. Even though this is a non-fluid-contact component, the material is suitable for fluid contact, and can be gamma radiated in clean room packaged kits. It may be installed on existing tube assemblies without disrupting the process fluid path.  ","HQP ","The Bio-Ease HD clamp is designed to be used in applications where regulatory compliance, seal integrity, and repeat ability are of the utmost importance.","Lightweight and Reusable RXBLLTAutoclavable to 135° C RXBLLTGamma Stable to 50 kGy RXBLLT90° Swing-Away Lock Nut RXBLLTUniversal Locking Jaws RXBLLTValidated Design RXBLLTLot Traceability",/product-images/tbl_pinch_valve_bio_ease_hd_clamp.jpg,,,,,,,,,,,"Autoclave, E-Beam, Gamma Irradiation, X-Ray",,,,
"Single-Use Clamps",SU,https://romynox.nl/sanisure-clamps?utm_source=catalogue_RVS&utm_medium=qrcode&utm_campaign=catalogue_page,3,378,3511,"SANISURE - Clamps","The Most Advanced Sanitary Clamp Design Ever","With the unique feature of a cable tie secured by a cable tie installation tool, the connection is NON-OPERATOR DEPENDENT and provides a VALIDATABLE TORQUE controlled compression each and every time. SaniSure® Clamps work by providing conforming compression on tri-clamp fittings. The result is an even clamping force on the entire fitting surface that no traditional ""rigid"" clamp design can achieve.","QHN ","The SaniSure CLAMP is the very first sanitary clamp design to offer a fast, safe, and secure way to connect plastic to plastic, plastic to BPE stainless steel, and BPE stainless steel to BPE stainless steel sanitary fittings.","Improve Safety RXBLLTSave on Set-Up Time RXBLLTValidatable RXBLLTNon-Operator Dependent RXBLLTMeets USP Class VI RXBLLTPatent Pending Design",/product-images/sanis_clamp.jpg,,3/4,"1 1/2",,,,,,,,"Autoclave, Gamma Irradiation",,,,
"Single-Use Clamps",SU,https://romynox.nl/tubing-clamp-large-12-position?utm_source=catalogue_RVS&utm_medium=qrcode&utm_campaign=catalogue_page,3,746,19656,"Tubing Clamp Large 12-position.","Maximum tubing O.D. = 0.75 inch (19.05 mm)",,"QTI ","Large tubing clamps with 12 ratchets designed for simple and quick on/off and flow control of fluid or air. Multiple colors available.","One-hand control RXBLLTCreated for disposable applications RXBLLT12 ratchet settings for precise control RXBLLTOn/off or flow control","/product-images/Large tubing clamp - 12-position blue.png",,,,,,,,,,,,,,,
"Single-Use Clamps",SU,https://romynox.nl/tubing-clamp-medium?utm_source=catalogue_RVS&utm_medium=qrcode&utm_campaign=catalogue_page,3,743,19661,"Tubing Clamp Medium","Maximum tubing O.D. = 0.50 inch (12.7 mm)",,"QTF ","Tubing clamps designed for simple and quick on/off control of fluid or air. Multiple materials and colors available.","One-hand control RXBLLTCreated for disposable applications","/product-images/Medium tubing clamp.png",,,,,,,,,,,,,,,
"Single-Use Clamps",SU,https://romynox.nl/tubing-clamp-medium-12-position?utm_source=catalogue_RVS&utm_medium=qrcode&utm_campaign=catalogue_page,3,745,19666,"Tubing Clamp Medium 12-position","Maximum tubing O.D. = 0.45 inch (11.43 mm)",,"QTH ","Tubing clamps with 12 ratchets designed for simple and quick on/off and flow control of fluid or air. Multiple materials and colors available.","One-hand control RXBLLTCreated for disposable applications RXBLLT12 ratchet settings for precise control RXBLLTOn/off or flow control","/product-images/Medium tubing clamp - 12-position.png",,,,,,,,,,,,,,,
"Single-Use Clamps",SU,https://romynox.nl/tubing-clamp-medium-6-position?utm_source=catalogue_RVS&utm_medium=qrcode&utm_campaign=catalogue_page,3,744,19671,"Tubing clamp Medium 6-position","Maximum tubing O.D. = 0.45 inch (11.43 mm)",,"QTG ","Tubing clamps with 6 ratchets designed for simple and quick on/off and flow control of fluid or air. Multiple materials and colors available.","One-hand control RXBLLTCreated for disposable applications RXBLLT6 heavy-duty ratchets RXBLLTOn/off or flow control","/product-images/Medium tubing clamp - 6-position yellow.png",,,,,,,,,,,,,,,
"Single-Use Clamps",SU,https://romynox.nl/tubing-clamp-micro?utm_source=catalogue_RVS&utm_medium=qrcode&utm_campaign=catalogue_page,3,738,19676,"Tubing Clamp Micro","Maximum tubing O.D. = 0.160 inch (4.064 mm)",,"QTA ","Small tubing clamps designed for simple and quick on/off control of fluid or air. Multiple materials and colors available.","One-hand control RXBLLTCreated for disposable applications","/product-images/Micro tubing clamp purple.png",,,,,,,,,,,,,,,
"Single-Use Clamps",SU,https://romynox.nl/tubing-clamp-micro-bore?utm_source=catalogue_RVS&utm_medium=qrcode&utm_campaign=catalogue_page,3,742,19681,"Tubing Clamp Micro-bore","Maximum tubing O.D. = 0.110 inch (2.794 mm)",,"QTE ","Tubing clamps with micro-bore designed for simple and quick on/off control of fluid or air. Multiple materials and colors available.","One-hand control RXBLLTCreated for disposable applications  RXBLLTDesigned for micro-bore tubing RXBLLTSpecial colors available (minimum quantities required)","/product-images/Small tubing clamp - micro-bore red.png",,,,,,,,,,,,,,,
